Pokemon,Description
GligarGligar(グライガー)(0207),"Gligar is ascorpion-like Pokémon. Gligar is pink,[80]and depicted withpincersand astingertail.[234][78]Alongside scorpions, Gligar is also based on bats due to its bat-like wings and elongated ears. When hunting for prey, Gligar targets the prey's face before injecting poison into the prey using its stinger.[78]Gligar's name is a combination of ""glide"" and ""gargoyle"".[35]Pokémon DiamondandPearlintroduced an evolution to Gligar calledGliscor. In the anime, Ash obtained a Gligar for his team, which later evolved into a Gliscor.[241]"
SteelixHaganēru(ハガネール)(0208),"Steelix is a snake-like Pokémon.[242]It is the evolution the first generation PokémonOnix, occurring in-universe when an Onix is exposed to high amounts of pressure underground and consumption of iron, converting its body into a metallicdiamond-like structure.[129][243]Steelix is capable of burrowing to theEarth's core.[244]It can weigh around over 400 kilograms (880 lb) and is typically around 92 meters (302 ft) in length,[243][245]with records reaching up to nearly 1 kilometre (0.62 mi).[244][246]Steelix appears as a boss fight inNew Pokémon Snap.[247]In the anime, Steelix is owned by gym leader and main characterBrock,[242]originally starting out as an Onix.[248]Its name is a combination of ""steel"" and ""onyx"".[35]In the sixth generation, Steelix gained aMega Evolution.[244][246]"
SnubbullBurū(ブルー)(0209),"Snubbull and Granbull arebulldog-like Pokémon. Snubbull has a pink and blue coat,[249]quiveringjowls, beady eyes and anunderbite.[250][251]Despite its appearance, Snubbull is known for being playful and kind,[250]as well as being a popular Pokémon among women in the Pokémon world.[252][253]Prior to the release ofGoldandSilver, Snubbull first appeared in the short moviePikachu's Vacation.[251]Alongside bulldogs, Snubbull is also based oncù-sìth, a mythological creature that translates into English as ""fairy dog"".[254]Granbull is the evolution of Snubbull. Granbull is purple in color,[255]with a more sinister demeanor and brandishing two large teeth protruding from its jaw. Despite its shy and timid nature, it can still cause harm with its powerful jaw.[249]In-universe, Granbull is a popular Pokémon with children.[256]Snubbull and Granbull's names are partially derived from ""bulldog"", with Snubbull's combining with the word ""snub"" and Granbull's combining with the word ""grand"".[35]"
GranbullGranbull(グランブル)(0210),—
QwilfishHarīsen(ハリーセン)(0211),"Qwilfish is a Pokémon which has been stated to be based on theporcupinefishgenusdiodon, which have the ability to use powerful toxins to their advantage, a trait reflected in Qwilfish's ability to use poison.[83]It has also been compared to ablowfish[257]and apufferfish.[258]Qwilfish's name comes from the words ""quill"" and ""fish"".[35]Qwilfish, in the series' lore, is considered to be a weak swimmer. Qwilfish can inhale water and then use the pressure from its body to shoot toxic spines at enemies.[258]Qwilfish's spines have poison strong enough to cause a human to faint.[259]Pokémon Legends: Arceusintroduced aHisuian variant of Qwilfish, which has the ability to evolve intoOverqwil.[260]"
ScizorHassamu(ハッサム)(0212),"Scizor is a bipedal,praying mantis-like Pokémon.[71]It is the evolution ofScyther, obtainable after trading a Scyther holding a Metal Coat item to another player.[261]Scizor has a body composed of steel, which causes it to be unfazed by most attacks that come its way.[139][262]It is primarily red in color, with two pairs of grey retractable wings.[71]Scizor uses its wings to regulate its body temperature.[139][262]At the end of its arms are two large, round, metallic pincers, capable of cutting anything.[129][58]Scizor gained aMega EvolutioninPokémon XandY.[129]Alongside the praying mantis, Scizor's design may also take inspiration from flyingred antsandwasp mantidfly.[71]Scizor's Japanese name is a reference to the Japanese verb for ""to cut"" (hasamu),[175]whereas its English name derives fromscissors.[35]"
ShuckleTsubotsubo(ツボツボ)(0213),"Shuckle is a Pokémon that lives within a bumpy redshell,[263]which is covered inbarnacles.[252]Its shell serves two purposes: for Shuckle to hide inside it, and for Shuckle to store berries within it. Shuckle can also retreat from its shell when threatened.[263]When storing berries, Shuckle excretes digestive fluids from its toes onto the berries tofermentthem, eventually converting the berries into juice.[264][265]This liquid is consumed by both the host Shuckle as well as people.[263][266]Shuckle's design origins are ambiguous, with different writers suggesting what the Pokémon is based on. Writers fromKotaku,TheGamerandPaste Magazinesuggest the Pokémon is based onwormsandturtles.[129][263][264]The Journal of Geek Studiesbelieves Shuckle to possibly be based on anendolithicfungi.[71]Shuckle's name may be a combination of ""shuck"" and ""turtle"".[35]"
HeracrossHeracross(ヘラクロス)(0214),"Heracross is a bipedal,beetle-like Pokémon. It has a blue, armor-likeexoskeleton,[71][267]a large horn in the center of its head, and two antennae split between the horn.[268]The horn can differ in appearance depending on the Heracross's gender; females have heart-shaped tip whilst males have a two-prong cross-shaped tip.[269][71]Heracross can range from being docile to toppling over trees, depending on its mood and behavior.[58]Additionally, Heracross has a major role in the anime series, being one of the Pokémon Ash traveled with when exploring the Johto region.[268][270][271]Heracross is based on theJapanese rhinoceros beetle,[71][272]beetles known for their combativeness and strength ininsect fighting, which may have inspired the Pokémon's Fighting type.[51][273]However, its name originates from the ""Hercules beetle"" and ""cross"".[35]InPokémon XandY, Heracross received aMega Evolution.[268]"
SneaselNyūra(ニューラ)(0215),"Sneasel is a species of Pokémon with resemblance to bothcatsandweasels.[239][274][275]Sneasel was initially brown in color;[74]this was later changed to give Sneasel navy blue bodies with pink feathers,[276]with male Sneasel having a longer feather growing atop its head compared to females. The Pokémon has long claws, with which it punches into bark to climb trees.[277]It is described as being sneaky and deceptive, oftentimes stealing eggs from other Pokémon's nests and eating them.[277]Sneasel is likely based on the Japanese mythological creaturekamaitachi.[239]Sneasel's English name is a combination of ""sneaky"" and ""weasel"".[35]InDiamondandPearl, Sneasel can evolve intoWeavilewhen leveling up while holding a Razor Claw item at night.[278]InPokémon Legends: Arceus, aform of Sneaselnative to the Hisui region is introduced, which evolves intoSneasler.[279]"
TeddiursaHimeguma(ヒメグマ)(0216),"Teddiursa is abear cub-like Pokémon. Teddiursa is small, and has a definingcrescent moon-shaped marking on its head.[280]This mark can glow when consuminghoney.[281][282]It likes to lick its own paws as they are sweetened by being soaked in honey,[283]and also does so for comfort when nervous.[284]Alongside bear cubs, Teddiursa may be based onteddy bears.[281][282][285]Teddiursa evolves into Ursaring, agrizzly bear-like Pokémon.[282]Ursaring is brown in color and big and powerful in stature.[286][287]It has a yellow ring on its body representing afull moon.[281]It is often aggressive towards those that threaten its offspring, as well as to Pokémon such asPrimeapewhen searching for berries in the treetops.[282]Ursaring lives in forests containing tall trees andstreams, which is where it gathers food. It can snap trees with its forearms.[282][283]Alongside bears, Teddiursa and Ursaring are based on theconstellationsUrsa MinorandUrsa Majorrespectively.[288][281]Both Pokémon's English names contain the Latin word for bear ""Ursa"", with Teddiursa's combining it with ""teddy bear"" and Ursaring's combining with ""ring"".[35]Pokémon Legends: Arceusintroduced an evolution to Ursaring calledUrsaluna.[283]"
UrsaringRinguma(リングマ)(0217),Ursaluna (#901)
SlugmaMagumaggu(マグマッグ)(0218),"Slugma is aslug-like Pokémon. Slugma's body is composed entirely of moltenmagma, which it uses as acirculatory system. It has to continue moving, as otherwise its body would cool and harden, causing chunks to fall off and decrease Slugma's size.[289]Slugma also has two flames atop its head, acting asfeelers.[290]In media, the animatedPokétoonseries has an episode dedicated to Slugma.[291]Slugma's name is a combination of ""slug"" and ""magma"".[35]Magcargo, asnail-like Pokémon, is the evolution of Slugma. Magcargo carries ashellconsisting ofvolcanic rock,[289]as well as large yellow eyes.[292]Flames can erupt from any hole from its shell, turning Magcargo's habitat into a ""flash firezone"".[129]It is stated in the Pokédex that Magcargo'sbody temperaturereaches 18,000 degreesFahrenheit, twice the temperature of the surface of the sun.[292][293]Magcargo's name may be a combination of ""magma"" and ""escargot"",[35]as well as ""cargo"".[289]"
MagcargoMagcargo(マグカルゴ)(0219),—
SwinubUrimū(ウリムー)(0220),"Swinub is a pig-like Pokémon.[294]It evolves into Piloswine.[295]Swinub has a powerful nose that allows it to discover hot springs.[294]Piloswine's hairs stand up straight when charging at enemies, and are sensitive to sound.[296]Swinub's English name come from the words ""swine"" and ""nub"", while Piloswine's comes from ""pilose"" and ""swine"".[35]Mamoswine, an evolution to Piloswine, was introduced inPokémon DiamondandPearl.[109]"
PiloswineInomū(イノムー)(0221),Mamoswine (#473)
CorsolaSanīgo(サニーゴ)(0222),"Corsola is a Pokémon greatly resembling coral. It has been considered similar to various types of coral, including the orderscleractinia, which have a stony skeleton, theanthozoagroup ofcnidarians, andjanaria mirabilis.[297]Corsola has strong regenerative properties, akin to other real-world coral types.[297]Corsola's English name comes the words ""coral"" and ""solar"".[35]An alternate form of Corsola, namedGalarian Corsola, was introduced inPokémon SwordandShield. Galarian Corsola resembles dead coral, as well as the coral typeacropora. Galarian Corsola, unlike regular Corsola, evolves intoCursola.[298]"
RemoraidTeppouo(テッポウオ)(0223),"Remoraid is based on aremorafish, and has amutualisticrelationship with themanta rayPokémonMantine, with Remoraid clinging onto the underside of Mantine.[83]Remoraid evolves into Octillery, which resembles anoctopus.[299]Remoraid resembles a gun, while Octillery resembles a tank.[300]During the development ofGoldandSilver, Octillery was originally had a more aggressive design, brandishing anarmy helmetatop its head.[137]Remoraid's English name comes from the words ""remora"" and ""raid"", while Octillery's comes from the words ""octopus"" and ""artillery"".[35]"
OctilleryOkutan(オクタン)(0224),—
DelibirdDelibird(デリバード)(0225),"Delibird is a penguin-like Pokémon which greatly resemblesSanta Claus.[301][302]It has a tail resembling a gift sack, which it uses to store items in.[303]Delibird's English name is a combination of the words ""delivery"" and ""bird"".[35]Delibird has been regarded as a notoriously weak Pokémon in battle by thePokémoncommunity.[304]AParadox Pokémonintroduced inPokémon ScarletandViolet, namedIron Bundle, resembles a robotic version of Delibird. Unlike Delibird, Iron Bundle was regarded for its strength among the community, and was banned from popular competitive formats as a result.[304]A fan campaign called ""Operation Delibird"", started in 2013, involves players sending Delibird to other players overChristmasandBoxing Day, with the campaign being created to combat negativity in the Pokémon community.[305]"
MantineMantine(マンタイン)(0226),"Mantine is amanta ray-like Pokémon, with similarities with theManta birostrisbeing described byThe Journal of Geek Studies.[83]Remoraid attach under Mantine's dorsal fins as part of amutualisticinteraction, which Mantine does not mind.[297]Mantine's name comes from the words ""manta"" and ""tine"".[35]InPokémon DiamondandPearl, a pre-evolved form of Mantine, namedMantyke, was introduced. Mantyke evolves into Mantine when it is leveled up with a Remoraid in the same party as Mantyke.[306]InPokémon Ultra SunandUltra Moon, Mantine appear as part of in-game minigame called ""Mantine Surfing"", in which players surf on the backs of Mantine.[307][308]"
SkarmoryEāmudo(エアームド)(0227),"Skarmory is abird-like Pokémon. Skarmory's body consists ofsteel, withIGNcomparing its head to aboat hook.[309]Its body is primarily a silver color with red highlights under its wings.[310]Skarmory's feathers are razor-sharp, being used by both warriors and high-end chefs as swords and knives respectively. In flight, Skarmory is capable of reaching incredibly high speeds.[311][312]Skarmory's name is a combination of ""sky"" and ""armory"".[35]"
HoundourDerubiru(デルビル)(0228),"Houndour and Houndoom aredog-like Pokémon based on thedobermannbreed. Houndour is black and brown in color withskeletonparts along its head, back, and legs.[313]Houndoom is the evolution of Houndour.[314]Alongside more skeleton parts on its body, Houndoom has two horns atop its head and a skull pendant on its chest. It also has a spearhead-shaped tail.[315]Houndoom is capable of breathing fire, with its flames being coated in toxins.[58]If a person is hit by its flames, their burns never heal nor will the pain ever go away.[129][316]Houndoom may be based on the idea ofhellhounds,[317][315]more specificallyCerberus.[129]Houndour and Houndoom's names derive from the word ""hound"", with Houndour's being in combination with the word ""dour"" and Houndoom's in combination with the word ""doom"".[35]"
HoundoomHerugā(ヘルガー)(0229),Mega Evolution
KingdraKingdra(キングドラ)(0230),"Kingdra is aseahorse-like Pokémon and the evolution ofSeadra.[318][319]Kingdra is primarily blue in color;[320]it is depicted with leaf-like fins and a long snout.[83][321]Kingdra typically sleeps on thesea floor, awakening during storms to search for prey.[139]The Pokémon is likely based onphyllopteryx taeniolatus, also known as common seadragons.[83][51]Kingdra's name is a portmanteau of ""king"" and ""dragon"".[35]"
PhanpyGomazō(ゴマゾウ)(0231),"Phanpy and Donphan areelephant-like Pokémon. Phanpy is small, red and blue, possessing an elongated trunk and large ears. Despite its small size, it can carry humans on its back and crush bones with its trunk.[322][323]Phanpy digs pits near river edges, marking the area as its nest with its trunk.[323]Donphan is the evolution of Phanpy. Upon evolving, Donphan develops a tough armor-like hide and gains physical strength, being capable of destroying a house in a single hit. Donphan is known for performing the move Rollout, often described as being its signature move,[324]with the hide on its back making Donphan look like a tire when performing the move.[322][325]Donphan are typically docile, only retaliating when enraged.[322]The Paradox PokémonGreat TuskandIron Treadsgreatly resemble Donphan.[322][326]Prior toGoldandSilver's release, Donphan made its first appearance inPokémon: The First Movie.[325]In thePokémonanime, Ash obtained a Phanpy after hatching one from an egg, which later evolves into Donphan.[323]Both Pokémon's names originate from the word ""elephant""; with Phanpy combining the word with ""pygmy"", whereas Donphan is combined with ""don"".[35]"
DonphanDonphan(ドンファン)(0232),—
Porygon2Porygon 2(ポリゴン2)(0233),"Porygon2 is the evolution ofPorygon, who was introduced inPokémon RedandBlue.[327]Due to the incorporation ofartificial intelligence, the Pokémon can develop itself on its own by learning about different subjects. It can even communicate in a secret language only other Porygon2 can understand.[328]Porygon2 is based on a man-made higherpolygonrecreation of aduck,[13]acting as an upgrade of thelow polyPorygon.[329]Its name derives from the word ""polygon"".[35]In the Spaceworld demo leak, Porygon2 initially had the appearance of alioninstead of a duck.[27][13]DiamondandPearlintroduced an evolution Porygon2 calledPorygon-Z. It evolves when being traded to another player whilst holding the Dubious Disc item.[109]"
StantlerOdoshishi(オドシシ)(0234),"Stantler is adeer-like Pokémon. Stantler has brown fur,[330]with a large nose andantlers.[331]Stantler's horns grant the Pokémon psychic abilities, being able to create illusions, warp reality, and make people feel ill. Its antlers are seen as valuable works of art, leading to Stantler being hunted to near-extinction. The antlers also hold round balls that, if grounded into powder, grant aid to people when sleeping.[330][332]Stantler is based onreindeer, with the Pokémon being said to have pulledSanta'ssleighin-universe.[332]Stantler's English name is a combination of ""stag"" and ""antler"".[35]Nob Ogasawara, the English translator for thePokémonseries, had suggested ""Scaribou"" as an alternate name.[333]Stantler's Japanese name, Odoshishi, is in reference toshishi-odoshi.[334]InPokémon Legends: Arceus, Stantler is able to evolve intoWyrdeer.[335][336]"
SmeargleDōburu(ドーブル)(0235),"Smeargle is abeagle-like Pokémon. It has aberet-shaped head and apaintbrush-like tail, which it uses to paint with. Different Smeargle have different colored fluid on the tips of their tails, with the hue depending on its emotions,[337]although the color is typically depicted as green.[218]Smeargle uses this fluid to mark its territory, using a range of 5,000 different markings to do so.[337][338]Smeargle's name is a combination of ""smear"" and ""beagle"".[35][338]Its Korean name, Lubeudo (루브도), may originate from the Korean spelling and pronunciation of the French art museumMusée du Louvre(Lubeudo).[128]On its own, Smeargle only know the move Sketch, its signature move. In battle, using Sketch allows Smeargle to permanently learn the last move that its target had used.[129][339]Due to Sketch, Smeargle has become notorious in thecompetitive Pokémon scene. Many tournaments, such as thePokémon World Championships, have teams featuring a Smeargle that had the ability Moody, which alters two stats every turn, and knew the move Dark Void, the signature move ofDarkrai, capable of putting opponents' Pokémon to sleep. This moveset lead to many players feeling frustrated with having to plan for and battle Smeargle, causing many in the community to call for rule changes or for Smeargle to be banned from competitive play.[340][341][342]"
TyrogueBarukī(バルキー)(0236),"Tyrogue is a baby Pokémon and is primarily pink and brown in color.[343]Tyrogue has the ability to evolve into one of three Pokémon based on its in-game statistics: if its attack is higher than its defense, it evolves intoHitmonlee, if its defense is higher than its attack, it evolves intoHitmonchan, and if both stats are equal, it evolves intoHitmontop.[344]Tyrogue is one of the main characters in thePokémonmanga.[345]Tyrogue's name is a combination of ""tyro"" and ""rogue"".[35]Hitmontop is an evolution one of Tyrogue's evolutions.[346]Hitmontop evolves from Tyrogue when its attack and defense stats are equal.[347]Hitmontop's fighting style is based off the style ofcapoeira.[347][348]It can also spin on its head like atop.[349]Hitmontop's name comes from the words ""hit"", ""mon"", and ""top"".[35]In an earlier version ofGoldandSilver, Hitmontop originally had three feet as well as brandishing a third eye.[137]"
HitmontopKapoerā(カポエラー)(0237),—
SmoochumMuchūru(ムチュール)(0238),"Smoochum is a baby Pokémon and the pre-evolution ofJynx.[98][350]Smoochum is depicted as being pink with a pouty expression on its face.[98][351]It uses its lips to understand the world around it, kissing everything it comes into contact with.[350][351]It is clumsy, oftentimes tripping over after running, causing it to check its reflection to make sure it has no mud on its face.[350][352]Smoochum's name is a combination of ""smooch"" and ""them"".[35]"
ElekidElekid(エレキッド)(0239),"Elekid is a baby Pokémon and pre-evolution ofElectabuzz.[353]This Pokémon has a largeplugon its head.[354]Elekid stores electricity in its body, which discharges when touching metal. To regain the electricity, it swings its arms in circles to recharge;[355]though it can only do this for a short time before tiring out. They also compete withTogedemarufor electricity. Elekid becomes happy upon hearing thunderstorms.[353]Elekid is a portmanteau of the ""electric[ity]"" and ""kid"".[35]"
MagbyBubii(ブビィ)(0240),"Magby is a baby Pokémon and the pre-evolution ofMagmar. Magby is bipedal and has a beak, a lizard-like tail,[329]and protrusion on its head.[356]It is capable of breathing fire, which can be used to determine its health; yellow flames indicate good health, andblack smokeindicatesfatigue.[357][358]Magby can be found in volcanic areas and be seen soaking in magma.[329]Likewise, it possesses magma-like blood which regulates its body temperature of around 1,000 °F (538 °C).[357]In its design, Magby shares similarities with bothducksandsalamanders.[329]Magby's name is a combination of ""magma"" and ""baby"".[35]"
MiltankMiltank(ミルタンク)(0241),"Miltank is acow-like Pokémon with a pink body.[218]Miltank can only be found as female, often considered the counterpart to the bull-like PokémonTauros, which can only be found as males.[359]Miltank produces a product called Moomoo Milk from itsudders,[118]of which it can produce up to five gallons a day.[359]This milk contains high amounts of nutrients, which can heal sickness and injury in both people and Pokémon.[118][360]When young, drinking Miltank's milk helps people grow strong.[361]Miltank is notoriously owned by the Johto gym leader Whitney, with the Pokémon constantly using powerful attacks and self-healing moves.[362][363][364]This fight is often cited by critics and the fandom as one of the hardest and most frustrating battles in thePokémonseries.[365][366][367][368]Miltank's name is a portmanteau of ""milk"" and ""tank"".[35]"
BlisseyHapinasu(ハピナス)(0242),"Blissey is a large, pink Pokémon, and an evolution ofChansey.[369]Blissey carries an egg with it that, when eaten, gives happiness to its eater.[370]Blissey has the highest health of every Pokémon in the series,[371]and additionally gives a high amount of experience when defeated.[372]Blissey's name comes from the word ""bliss"".[35]In the anime, Blissey helpNurses Joy, and assist with healing Pokémon.[373]InPokémon Go,Blissey was notorious for its high health, which made it difficult to defeat in several of that game's modes.[374][375]A pre-evolved form of Chansey and Blissey, named Happiny, was introduced inPokémon DiamondandPearl.[376]"
RaikouRaikou(ライコウ)(0243),"Raikou, Entei, and Suicune make up a group of Legendary Pokémon known as the Legendary Beasts,[377]also known as the Legendary Dogs.[378]The three represent the elements of electricity, fire, and water, respectively.[379]In the game series' lore, the three were a group of Pokémon who died when a tower they were in caught on fire. The Legendary Pokémon Ho-Oh revived them from death in their current forms,[380]with their types representing the lightning that caused the fire, the fire itself, and the rain that eventually quelled the tower fire.[381]The three are often difficult to obtain in the games, as many appearances have them ""roam"" around the region, requiring the player to track down their location.[378][382]The trio are prominently featured in the moviePokémon—Zoroark: Master of Illusions.[383]Raikou is atiger-like Pokémon.[384]Raikou is likely inspired bysaber-toothed tigersas well as the concept ofthunderstorms.[383]It is depicted as having sharp teeth and is rather distrustful of humans.[58]Unlike the other legendary beasts, Raikou does not have a dedicated movie, instead featuring in three episodes ofPokémon Chronicles.[383]Raikou's name comes from the words ""rai"", the Japanese word for lightning, and ""kotei"", the Japanese word for emperor.[35]Entei is alionandmastiff-esque Pokémon.[381]In the games' lore, volcanoes are said to erupt when Entei barks, and is said to have been born from an active volcano.[385]It is also capable of producing magma from its mouth.[58]Entei is considered widely popular among the fanbase due to its role in the moviePokémon 3: The Movie,[386]in which it plays a major role.[387]Entei's name comes from ""enten"", a word meaning ""scorching heat"" in Japanese, and ""kotei"".[35]Suicune has been described as both a feline-like[nb 9][381]and dog-like Pokémon,[388]and is capable of purifying water.[389]Suicune acts as the primary mascot and appears on the cover of the gamePokémon Crystal,[390]where it has its own plotline.[391]Suicune appears inPokémon 4Ever, where it plays an important role.[391]Another Suicune appears in the anime seriesPokémon Journeys: The Series, where main protagonistGohcaptures it.[392]Suicune's name comes from ""sui"", the Japanese word for water, and ""kun"", a suffix denoting respect in Japanese.[35]The Beasts were designed by manga artist Muneo Saito.[393]Saito later released an unused design for a Pokémon resembling Raikou in 2014.[393]Pokémon ScarletandVioletlater introduced three Paradox Pokémon resembling Raikou, Entei, and Suicune namedRaging Bolt,[384]Gouging Fire,[394]andWalking Wake, which greatly resemble dinosaurs.[384]"
EnteiEntei(エンテイ)(0244),No evolution
SuicuneSuicune(スイクン)(0245),No evolution
