Pokemon,Description
MespritEmuritto(エムリット)[54](0481),"Known as the ""Being of Emotion"", this Legendary Pokémon taught humans emotions such as sorrow, pain, and joy. Although it slumbers at the bottom of a lake, its spirit is said to fly on top of it. It is feared as those who disrespected it would have their emotions thrown into disarray."
AzelfAgunomu(アグノム)[10](0482),"Known as the ""Being of Willpower"", this Legendary Pokémon sleeps at the bottom of a lake to keep the world in balance. It is thought that Uxie, Azelf and Mesprit all came from the same egg. When Azelf flew, people gained the willpower and determination to do things. It was dreaded in Hisui, as tales of it show that it manipulated the will of others, turning them into a puppet of its own."
DialgaDiaruga(ディアルガ)[55](0483),"Part of the Trio of Creation, this Legendary Pokémon has complete control over time and it can use it to travel to the past, present, future, as well as to start and stop time at will. It appears as a deity in myths and legends. It is thought that when Dialga was born, time began, and with every heart beat, time grows more stable. Its signature move isRoar of Time."
PalkiaParukia(パルキア)[56](0484),"Part of the Trio of Creation, this Legendary Pokémon has complete control over space and dimensions . It can use its power to distort space and create and destroy dimensions at will. It appears as a myth and a deity in Sinnoh legends. It is thought that when Palkia was born, space and dimensions were created, and with every breath it takes, space grows more stable. It is theorized that it lives in a gap in the spatial dimension parallel to our own. Its signature move isSpacial Rend."
HeatranHīdoran(ヒードラン)[9](0485),"It lives in volcanic caves as it climbs walls with its cross shaped feet. Its body is made of rugged steel, but due to its own body heat, it is partially melted in some spots. Boiling blood like magma circulates in its body. Stories of it tell that it was born from magma on Mount Coronet. Untilgeneration 8, with the introduction of Kubfu, Heatran was the only legendary Pokémon with a 50-50 gender ratio of male to female."
RegigigasRejigigasu(レジギガス)[8](0486),"There is an enduring legend about how this Legendary Pokémon towed the continents together with just rope. It created smaller versions of itself out of clay (Regirock), a special ice mountain (Regice), magma (Registeel), electrons (Regieleki), and dragon energy (Regidrago)."
GiratinaGiratina(ギラティナ)[57](0487),"It is capable of changing between ""Altered"" and ""Origin"" Formes. The final member of the Trio of Creation, this Legendary Pokémon has complete control of antimatter and can use it to make all common knowledge distorted and strange. It appears in myths and legends. Because of its violence, it was banished to the Distortion World, a universe where all knowledge is confusing, and it gazes from there. It sometimes appears in cemeteries. There is one Hisuian verse that tells of a powerful light creating a deep shadow. That deep shadow could be Giratina. In order to change between the Altered and Origin forms, the player must give it the Griseous Orb. Its signature move isShadow Force."
CresseliaKureseria(クレセリア)[58][12](0488),"Part of the Lunar Duo, one who holds Cresselia's feather can make a Darkrai's horrible nightmare vanish and have joyful dreams. Cresselia represents thecrescent moon."
PhioneFione(フィオネ)[59](0489),"It can only be obtained by breeding Manaphy, however Phione are incapable of evolving into Manaphy. It is a member of the Sea Guardian Duo along with Manaphy. These Mythical Pokémon live in packs in warm seas. It inflates the sac on its head to drift and look for food. It always returns to where it was born, no matter how far way it may have drifted. Its azure body blends in with the surrounding water, theoretically being a defense mechanism. It is based onClione Limacina, and its English name is a portmanteau of the last syllable of Manaphyand the wordClione."
ManaphyManafi(マナフィ)[60](0490),"Manaphy is other member of the Sea Guardian Duo along with Phione. Manaphy was the last Pokémon in the Sinnoh Pokédex before thePlatinumexpansion. This Mythical Pokémon lives on the cold sea floor. It always returns to where it was born, no matter how far way it has drifted. Water makes up 80% of its small body, so it is easily affected by its environment. It is born with a wondrous power to let it befriend any creature. It greatly resembles Phione, though the relation is unclear. It is based onClione Limacina."
DarkraiDākurai(ダークライ)[14](0491),"Darkrai was officially revealed in February 2007. It is the other member of the Lunar Duo together with Cresselia. Though it means no harm, it can lull people to nightmarish sleep to protect its territory on moonless nights."
ShayminSheimi(シェイミ)[6](0492),"""Land Forme""Shaymin has a second Forme activated by using a Gracidea flower in the daytime. Shaymin's Sky Forme will revert to its Land Forme during the night, while frozen solid, or if deposited in the PC. Its Land Forme is based on ahedgehog. This Mythical Pokémon lives in flower patches and avoids detection by curling up to blend in. It can dissolve toxins in the air, instantly transforming devastated lands into beautiful paradises. If hugged and loved enough, beautiful flowers will appear all over its body. When winter ends and spring begins, people in Hisui celebrate and Shaymin comes to cover the land with lush flowers."
Unknown,"""Sky Forme""As opposed to its original Land Forme, Shaymin becomes the Grass/Flying-type Sky Forme. Shaymin was officially revealed in February 2008, when it was listed as a star of Giratina and the Sky Warrior. In early June of the same year, its Sky Forme was revealed and based on adeerand anangel. When this Mythical Pokémon smells the scent of the particularly rare Gradicea flower, its tiny body transforms into this form. Some people also smelled the flower, but their bodies remain unchanged."
ArceusAruseusu(アルセウス)[16](0493),"Arceus is a whitellama-like Pokémon with a goldenarchon its back. It serves as thecreator deityfor the Pokémon universe. The Pokémon's name in both English and Japanese may be derived from theAncient Greekword ""arkhé"" (αρχή), meaning ""origin"" or ""beginning"". It may also be derived from ""alpha"", ""deus"", aLatinword meaning ""god"", or ""archeus"", a part of theastral planeinalchemy.[61]When exposed to a plate of a specific type, Arceus changes its type and color to match that plate.[62]With the Legend Plate, however, Arceus' type changes dynamically to whichever would be the most effective on the opponent.[63][64]Arceus debuted in the movieArceus and the Jewel of Life, where it serves as one of the film's main characters.[65]In the Pokémon universe, Arceus is known as ""The Original One"", as it is told in mythology that it emerged from an egg before the universe even existed, and that it ""shaped all there is in this world"".[66][67]It is also said to have created severalLegendary Pokémonwith its ""1,000 arms"".[68][69]It appears inPokémon Legends: Arceus, where it takes a central role.[70]Arceus also stars inPokémon: The Arceus Chronicles, a miniseries that takes some inspiration fromLegends: Arceus.[71]Arceus and Smeargle are the only two Pokémon that can learn its signature moveJudgement.[72]"
VictiniBikutini(ビクティニ)(0494),"Victini is a small, rabbit-esque Pokémon that has large, pointed ears that form the letter V. It has large, blue eyes, and a round, cream-coloured head that is comparatively large compared to its small, cream body, while the tops of its ears, crest, and extremities are all orange. Its bulbous arms and legs are rounded to make a sort of ""cuff"" before ending with small, three-fingered hands and two-toed feet. It has two pointed teeth that can be seen on its upper jaw. It also has two cream winglike tails, which allows it to fly. Although Victini is timid, it is a caring Pokémon, as it will fight if its friends are in danger. Victini is said to bring victory to the Trainer that befriends it no matter the matchup. It produces an infinite amount of energy within itself and can share it with others by touch. It can also become invisible. Victini is the only known Pokémon that can learn both theSearing ShotandV-createmoves."
SnivyTsutāja(ツタージャ)(0495),"An antisocial species, it prefers to avoid groups. It can photosynthesize with the leaves on its tail. They start to droop when Snivy loses energy. Before its English name was revealed, fans referred to it as Smugleaf.[5]"
ServineJanobī(ジャノビー)(0496),It moves along the ground as if it was sliding. Its swift movements befuddle its foes and it then attacks with a vine whip.
SerperiorJarōda(ジャローダ)(0497),"It can stop its opponents' movements with just a glare. It takes in solar energy and boosts it internally. It is based on theTitanoboaas well as European nobility, specifically,Lady OscarofThe Rose of Versailles.[6]Its name is a portmanteau of ""serpent"" and ""superior""."
TepigPokabu(ポカブ)(0498),"This orange and black pig-like Pokémon blows fire through its nose. When it catches a cold, the fire becomes pitch-black smoke instead."
PigniteChaobū(チャオブー)(0499),"When its internal fire flares up, its movements grow sharper and faster. When it is in trouble, it emits smoke."
EmboarEnbuō(エンブオー)(0500),"A flaring beard of fire is proof that it is pumped up. It is adept at using many different moves. Emboar was designed to embody Chinese culture. Similar to Serperior it is based on a specific character, Zhang Fei ofRomance of the Three Kingdoms, a classic novel in Chinese literature.[6]"
OshawottMijumaru(ミジュマル)(0501),"Oshawott is known as theSea OtterPokémon. The shell on its belly (known as a ""scalchop"") is made of the same components as fingernails. Strangely, the scalchop has been known to grow from Oshawott'snavel.[7]It can detach the scalchop from its body and use it as a blade.[8]"
DewottFutachimaru(フタチマル)(0502),"Dewott's appearance is somewhat similar to Oshawott except that it is primarily light-blue in colouration and has white whiskers and a blue adornment with two scalchops around its waist. Like Oshawott, these can be detached and used as weapons. With rigorous training, Dewott acquires the ability to perform two-shell attacks with flowingswordsmanship.[9]Unlike its pre-evolutions, Dewott was also the last of the second form of the starters to be designed. In an interview withKen Sugimori, he stated that they were concerned on what to make Oshawott evolve into after watching sea otters at a zoo."
SamurottDaikenki(ダイケンキ)(0503),"Samurott is a quadruped,sea lion-esque Pokémon, radically different in appearance from Dewott. Part of the armor on its front legs can become a giant sword, and one swing of the sword incorporated in its armor can fell an opponent. A simple glare from one of them quiets everybody and its cry alone is enough to intimidate most enemies. In the time it takes a foe to blink, it can draw and sheathe the armored swords attached to its front legs. Sugimori decided to make the third evolution based on asea lion, with Oshawott's shell turning into a sword, and also stated that Oshawott's evolution would be Japanese style of design, cited the powerful nature from them such as the ""sound they made when they stamped on the ground"",[10][11]and intended to design Samurott to be a completely different shape from Oshawott. InPokémon Legends: Arceus, it was given aHisuian Form."
PatratMinezumi(ミネズミ)(0504),"They live in colonies. when the group is sleeping, one stays awake to watch, although they never see foes coming from behind."
WatchogMiruhoggu(ミルホッグ)(0505),"When Watchog sees an enemy, its tail will stand straight and it spits seeds that it stores in its cheek pouches. Using luminescent matter, it makes its eyes and body glow."
LillipupYōterī(ヨーテリー)(0506),"It is a good starting Pokémon because it listens well and easy to train. As its Japanese name suggests, Lillipup is based on aYorkshire Terrier."
HerdierHāderia(ハーデリア)(0507),"It is completely faithful to its trainer and has helped trainers in raising other species since long ago. Herdier is a very smart and friendly Pokémon. Because of this, there is a theory that Herdier was the first Pokémon to partner with people.[12]"
StoutlandMūrando(ムーランド)(0508),"Its fur is warm enough that someone wrapped in it would not feel the cold of a blizzard on a snowy mountain. It would never harm a human. They are incredibly friendly and are used as rescue Pokémon, tracking people lost in mountains."
PurrloinChoroneko(チョロネコ)(0509),"Purrloin tries to steal things like jewelry from women, the victims think that the act is so cute that they let it slide. Despite its posture suggesting that it walks on all fours, it is actually a biped."
LiepardReparudasu(レパルダス)(0510),"Liepard is known as the ""Cruel Pokémon"" and is the evolved form of Purrloin. Well known for its beauty, Liepard uses the element of surprise when battling opponents, attacking before they can react. Its name is a portmanteau of ""lie"" and ""leopard""."
PansageYanappu(ヤナップ)(0511),"Eating its leaves relieve stress and it readily shares them with weary Pokémon. It is meant to resemble part of the cooking process, namely farming and growing ingredients. Pansage also represents Iwazaru, one of theThree Wise Monkeys, and the figure of ""speak no evil""."
SimisageYanakkī(ヤナッキー)(0512),It attacks with its thorn covered tail. It has a poor temper and is quick to anger.
PansearBaoppu(バオップ)(0513),"Spending its time in volcanic caves, it roasts berries before eating them. Pansear displays the final part of the cooking process, the actual cooking part. It also represents Kikazaru, of theThree Wise Monkeys, and the figure of ""hear no evil""."
SimisearBaokkī(バオッキー)(0514),"It is a friendly creature, and easily excitable. When it gets excited embers fly from its body. In a 2016 vote by Corocoro to determine who the most popular Pokémon is, Simisear was ranked in last place among the 721 different species at the time."
PanpourHiyappu(ヒヤップ)(0515),"Its water is full of nutrients. Any plant receiving its water is guaranteed to grow to great size. Panpour enacts the cleaning process of cooking, and represents Mizaru, one of the Three Wise Monkeys and the figure of ""see no evil""."
SimipourHiyakkī(ヒヤッキー)(0516),"It is a docile Pokémon and rather friendly. It often can be seen watering flowers. Despite this, Simipour can demolish a concrete wall with the pressurized water it shoots from its tail."
MunnaMunna(ムンナ)(0517),"It consumes dreams and then emits mist, the colour of which corresponding to if the consumed dream was a good one or a nightmare."
MusharnaMushāna(ムシャーナ)(0518),"The mist it emits forms the shape of objects from recently eaten dreams. It becomes angry when roused from sleep. Both Musharna and Munna are based onbaku, dream eating tapirs from Japanese mythology."
PidoveMamepato(マメパト)(0519),"They live in cities, are accustomed to people, and are extremely forgetful. They are based onturtle doves, and their connection with love; In fact, they have a heart-shaped motif on the place where the beak connects to their head."
TranquillHatōbō(ハトーボー)(0520),"Due to it always knowing where its nest is, it never gets separated from its trainer."
UnfezantKenhorō(ケンホロウ)(0521),"They are very intelligent and prideful. Males have extravagant plumage, forming the shape of a heart on their head. Females have better flying ability."
BlitzleShimama(シママ)(0522),The flashes it produces helps it communicate with others by using patterns. It can catch lightning with its mane and store the electricity.
ZebstrikaZeburaika(ゼブライカ)(0523),"They are quite ill-tempered. When they are angry, lightning shoots out of their mane in all directions. When Zebstrika run at full speed, the sound of thunder reverberates."
RoggenrolaDangoro(ダンゴロ)(0524),"It is apebble-like Pokémon with a yellow eye. The orange part of its body (on its head) is actually its ear. It is curious enough to follow sounds, but if the sounds stop, it freaks out and topples over."
BoldoreGantoru(ガントル)(0525),They move around without turning their bodies. Their crystals glow when they are about to shoot an energy beam.
GigalithGigaiasu(ギガイアス)(0526),They can absorb solar energy and shoot beams capable of blowing away dump-trucks. They are popular with construction workers.
WoobatKoromori(コロモリ)(0527),"They hang onto cave walls with their noses, leaving heart-shaped marks. Seeing one on your body is a sign of good fortune."
SwoobatKokoromori(ココロモリ)(0528),Their ultrasonic waves can shatter concrete. Ultrasonic waves created by males during mating season bring happiness to those who hear them.
DrilburMoguryū(モグリュー)(0529),"By spinning its body 360 degrees, it can dig easily through the ground. Its digging causes damage to vegetable crops, so farmers have little love for it."
ExcadrillDoryūzu(ドリュウズ)(0530),"They are known as ""The Drill King"" and build nests more than 300 feet beneath the earth's surface. Excadrill can tunnel through the terrain at speeds of over 90 mph. It is not uncommon for tunnels that appear to have formed naturally to actually be a result of Excadrill's rampant digging."
AudinoTabunne(タブンネ)(0531),Audino is a pink bipedal rabbit-like Pokémon that commonly work in Pokémon centers. Audino is the only Generation V Pokémon that has aMega Evolution.
TimburrDokkorā(ドッコラー)(0532),"It fights by swinging a piece of lumber around, and you can tell that it's close to evolving when it can handle the weight of the lumber without difficulty. They tend to appear at building sites and help out with construction. It loves construction sites so much that if rain causes work to halt, it swings its log around and throws a tantrum. They always carry squared logs and as they grow, they carry bigger logs that are almost triple their size."
GurdurrDotekkotsu(ドテッコツ)(0533),A group of wrestlers could not make it bulge an inch. It can topple buildings with its steel beam.
ConkeldurrRōbushin(ローブシン)(0534),It is said to have taught humans how to create concrete. It masterfully utilizes the centrifugal force of its concrete pillars in battle.
TympoleOtamaro(オタマロ)(0535),They communicate by vibrating their cheeks. People and other Pokémon species cannot hear its cries.
PalpitoadGamagaru(ガマガル)(0536),"When they vibrate the bumps on their heads, they can make waves in water or earthquake-esque vibrations on land. Their cries are sublimely pleasing to the ear. Palpitoad with larger lumps on their bodies can sing with a wider range of sounds."
SeismitoadGamageroge(ガマゲロゲ)(0537),Its vibrating bumps are great for massages and it is popular with the elderly because of this. It can shatter boulders with one punch. It is closely related toCroagunk.
ThrohNageki(ナゲキ)(0538),"Throh is driven by an irresistible urge to throw larger opponents. Wild Throh use vines as belts, which increases its power when tightened. It is based on the fighting styleJudo."
SawkDageki(ダゲキ)(0539),"They train constantly to obtain the strongest karate chop and are enraged if this is disturbed. Like Throh it is based on a fighting style,Karate."
SewaddleKurumiru(クルミル)(0540),Sewaddle makes its own cloths out of leaves and other materials. It is a popular mascot for fashion designers.
SwadloonKurumayu(クルマユ)(0541),It protects itself from the cold by wrapping up in leaves. It spends all day eating fallen leaves. Swadloon-filled forests have excellent plant life.
LeavannyHahakomori(ハハコモリ)(0542),"It makes clothes from leaves and silk for small Pokémon. It keeps its eggs warm with leaves. Its arms end in sharp needles, which Leavanny uses with grace and efficiency ."
VenipedeFushide(フシデ)(0543),An insectoid Pokémon with a pronounced hump on the upper portion of its body. Its bite can paralyze large bird Pokémon. It tries to eat anything it can without much thought.
WhirlipedeHoīga(ホイーガ)(0544),"It tends to lay motionless and still, but is able to accelerate to high speeds when threatened. It is based onpill bugsand other similar insects."
ScolipedePendorā(ペンドラー)(0545),"A large horse-like millipede. It can run at high speed, trampling anything in its way. Scolipede engage in fierce territorial battles withCentiskorch. At the end of one of these battles, the victor makes a meal of the loser."
CottoneeMonmen(モンメン)(0546),"To protect itself, it shoots cotton from its body. When it gets wet in the rain, its cotton grows moist and heavy, and it cannot move. It is easily swept up and displaced by high winds."
WhimsicottErefūn(エルフーン)(0547),"As long as this Pokémon bathes in sunlight, its cotton keeps growing. If too much cotton fluff builds up, Whimsicott tears it off and scatters it. InPokémon X and Yit and its pre-evolution gained the Fairy typing."
PetililChurine(チュリネ)(0548),"The deeper the color of a Petilil's leaves, the healthier the Pokémon is. Petilil sometimes makes its home in a well-tended field or flowerbed."
LilligantDoredia(ドレディア)(0549),"Essential oils made from Lilligant flowers have a sublime scent, but they're also staggeringly expensive.Even veteran gardeners face a challenge in getting its beautiful flower to bloom. InPokémon Legends: Arceusit was given aHisuian Form"
BasculinBasurao(バスラオ)(0550),"Basculin are based on bass, and were added to showcase native fish of New York. It has two main forms, red and blue striped. They are aggressive in demeanor. InPokémon Legends: Arceusit was given a new form, white stripe, with the ability to evolve."
SandileMeguroko(メグロコ)(0551),"It moves along below the sand's surface, except for its nose and eyes. A dark membrane shields its eyes from the sun. In thePokémon Black & Whiteanime series Sandile is portrayed wearing shades. After evolving into Krokorok, it is later caught by Ash."
KrokorokWarubiru(ワルビル)(0552),Krokorok has specialized eyes that enable it to see in the dark. This ability lets Krokorok hunt in the dead of night without getting lost. They move in groups of a few individuals. A female is often the leader.
KrookodileWarubiaru(ワルビアル)(0553),"Thiscrocodile-esque Pokémon is known as the ""Bully of the Sands"". Krookodile's mighty jaws can bite through heavy plates of iron with almost no effort at all. Its incredible sight can detect small prey more than 30 miles away, even in the midst of a sandstorm."
DarumakaDarumakka(ダルマッカ)(0554),Its droppings are warm so people use them to keep themselves warm. It is based on aDaruma dolland also has aGalarian formthat is an Ice type.
DarmanitanHihidaruma(ヒヒダルマ)(0555),"This Pokémon's power level rises along with the temperature of its fire, which is able to reach 2,500 degrees Fahrenheit. If Darmanitan has its Hidden Ability, Zen Mode, upon losing at least half of its max HP, it will become Fire and Psychic type. ItsGalarian formis an ice type and its Zen Mode becomes an Ice and Fire type Pokémon."
MaractusMarakatchi(マラカッチ)(0556),"When it shakes its hands around, it sounds like maracas being played. Its English name is a portmanteau of ""maraca"" and ""cactus"". It is exclusive toCentralandSouth AmericainPokémon Go."
DwebbleIshizumai(イシズマイ)(0557),"A small scorpion like Pokémon, it makes it home in rocks and stones, making it resemble a hermit crab. If Dwebble's rock breaks, it remains agitated until it locates a replacement."
CrustleIwaparesu(イワパレス)(0558),"Crustle are highly territorial and often compete for territory, the one whose boulder is broken is the loser of the battle. Its thick claws are mighty enough to crack Rhyperior's carapace."
ScraggyZuruggu(ズルッグ)(0559),"Its headbutts are strong and brutal. Its shed skin hangs loosely around its waist, causing it to trip often. This shed skin is reminiscent ofsagged pants."
ScraftyZuruzukin(ズルズキン)(0560),"Its loose skin is reminiscent ofbalaclavasworn aroundNew York City, the basis for the Unova region. Despite having an aggressive temper Scrafty takes very good care of its family, friends, and territory."
SigilyphShinborā(シンボラー)(0561),"They never vary the route they fly, because their memories of guarding an ancient city remain steadfast. The guardians of an ancient city, they use their psychic power to attack enemies that invade their territory. Psychic power allows these Pokémon to fly. Some say they were the guardians of an ancient city. Others say they were the guardians' emissaries. A discovery was made in the desert where Sigilyph fly. The ruins of what may have been an ancient city were found beneath the sands. Sigilyph's design is based on theNazca Lines. It is found only around the East Mediterranean countries inPokémon Go."
YamaskDesumasu(デスマス)(0562),"Each of them carries a mask that used to be its face when it was human. Sometimes, they look at it and cry. ItsGalarian formis a Ground type on top of its Ghost type."
CofagrigusDesukān(デスカーン)(0563),A Ghost type Pokémon that based oncursed sarcophagus. It has been said that they swallow those who get too close and turn them into mummies. They like to eat gold nuggets. ItsGalarian counterpart Runerigusis a Ground type on top of its Ghost type.
