Pokemon,Description
PopplioAshimari(アシマリ)(0728),"Popplio aresea lionPokémon that can do tricks and form water bubbles from the snot from their ""clown-like nose"".[13][29]It uses these bubbles to fight in acrobatic displays."
BrionneOshamari(オシャマリ)(0729),"Brionne is a skilled dancer that uses its graceful movements to evade enemy attacks, all the while forming explosive water balloons to fight back. If it sees a dance it does not know it gets excited and will practice it day and night to perfect it."
PrimarinaAshirēnu(アシレーヌ)(0730),"Primarina takes inspiration frommermaids,sirens, andselkies. Its singing voice is its chief weapon in battle. Its throat requires daily maintenance to keep it healthy."
PikipekTsutsukera(ツツケラ)(0731),"Pikipek arewoodpeckerPokémon capable of pecking 16 times per second and with enough force to break stone.[30]The concept art for Pikipek was initially teased during the 26 February 2016,Nintendo Directwhich revealedPokémon SunandMoon.[31]The Pokémon was officially revealed on 14 June during Nintendo'sElectronic Entertainment Expopresser.[30]"
TrumbeakKerarappa(ケララッパ)(0732),"It spits out seeds from the fruits it eats at foes. The scattered seeds give rise to new plants, making it an essential Pokémon in many environments."
ToucannonDodekabashi(ドデカバシ)(0733),"They are able to superheat their beaks, the temperature is indicated by the color of its beak. Known for forming harmonious couples, this Pokémon is brought to wedding ceremonies as a good luck charm. Its English name is a portmanteau of ""toucan"" and ""cannon"", as the previous one indicates that Toucannon is based on agiant toucan."
YungoosYangūsu(ヤングース)(0734),"Yungoos are aninvasive speciesof Alolan Pokémon, brought to Alola to combat another invasive species, Alolan Rattata. Known for being voracious eaters, most of their elongated body is devoted to its stomach—they are almost constantly hungry and become angry when not eating.[30]"
GumshoosDekagūsu(デカグース)(0735),"A quiet and patient Pokémon, Gumshoos hunts its prey by lying in wait for hours at a time. It can't help but pounce on its favorite food, Rattata, and it holds a fierce rivalry with Raticate. It is designed to resemble detectives.The fur on Gumshoos's head has been said to bear a striking similarity to that of formerU.S. PresidentDonald Trump. However, in an interview withGame Informer, directorJunichi Masudastated that Gumshoos was designed ""a long time back, and we didn't have any intention to make it look like Donald Trump"". He did acknowledge the similarities, however.[32]Gumshoos is also a Totem Pokémon on Ilima's Trial inSunandUltra Sun."
GrubbinAgojimushi(アゴジムシ)(0736),Grubbin are larva Pokémon with powerful jaws. They have an affinity for electricity and are often found near power plants.[30]
CharjabugDenjimushi(デンヂムシ)(0737),Its digestive processes convert the leaves it eats into electricity. An electric sac in its belly stores the electricity for later use. Charjabug is based on a 9-volt battery.
VikavoltKuwaganon(クワガノン)(0738),It concentrates electrical energy within its large jaws and uses it to zap its enemies. Vikavolt hold an intense rivalry with Pinsir and Heracross. The latter two often team up against it. Often it can be seen carrying Charjabug for extra electricity. It is based on a stag beetle as well as arailgun. Vikavolt is the totem Pokémon of Sophocles's Trial inSunandMoon.
CrabrawlerMakenkani(マケンカニ)(0739),Its hard pincers shaped likeboxing glovesare well suited to both offense and defense. Crabrawler love berries and can only be encountered in berry piles. It is based oncoconut crabsandboxers.
CrabominableKekenkani(ケケンカニ)(0740),"It trains in snowy conditions. It stores coldness in its pincers and pummels its foes, and can even smash thick walls to bits. It is based on theyeti crab."
OricorioOdoridori(オドリドリ)(0741),"""Pom-PomStyle"" form is native to Melemele Island and is based on pom pom dancers. It rubs its two pom pom feathers together to create electricity and zaps its foes."
Unknown,"""Pa'uStyle"" form is native to Akala Island and is based on hula dancers. It gets stronger and stronger by singing and dancing."
Unknown,"""BaileStyle"" form is native to Ula'ula Island and is based on flamanco dancers. It beats it wings to create fire. As it steps to the rhythm of the music, it bathes its foes in flames."
Unknown,"""SensuStyle"" form is native to Poni Island and is based on sensu dancers. When the trainer gets its order wrong it gets passionately angry. By means of its dance, it gathers the spirits drifting about in an area and borrows their power to fight."
CutieflyAburī(アブリー)(0742),It feeds on the nectar and pollen of flowers. Its small size means it is not good in fights and prefers to flee. It is based on thebee fly.
RibombeeAburibon(アブリボン)(0743),"It makes pollen puffs from pollen and nectar, and Ribombee hates rain. When it sees ominous clouds, it finds a hollow in a tree, where it waits stock-still.  Different pollen can do different things depending on what its made of. It can either hurt foes or it can heal allies. It is the totem Pokémon of Mina's Trial inUltra SunandUltra Moon."
RockruffIwanko(イワンコ)(0744),Rockruff are dog Pokémon that evolve into one of three forms depending on which version of the game is being played (Generation VII) or the time of the day (Generation VIII). The Rock typing of Rockruff stems from the Pokémon possibly being based on the extinctHawaiian Poi Dog.[33]It shows affection by rubbing the sharp rocks on its neck on you.
LycanrocRugarugan(ルガルガン)(0745),"Rockruff evolves into Lycanroc's Midday Form, resembling awolf, inSunand into its Midnight Form, resembling awerewolf, inMoon; however, both forms can be caught in each game. A third form, Dusk Form, was introduced inUltra SunandUltra Moon. The Dusk Form evolves at sunset, but can only evolve from Rockruff with a Hidden Ability."
WishiwashiYowashi(ヨワシ)(0746),"Wishiwashi in its solo form has the lowest stats of any Pokémon. Its ability, Schooling, allows it to change forms into a school of hundreds of Wishiwashi, making it much stronger. Wishiwashi is based on thePacific sardine,[34]and is the totem Pokémon of Lana's Trial inSunandMoon. One alone is scared of everything, but when they all come together, everything is scared of it."
MareanieHidoide(ヒドイデ?)(0747),"It preys on Corsola for its delicious coral branches, because of this it is hated by craftsmen and fishermen who rely on Corsola. It is based on theAcanthaster."
ToxapexDohidoide(ドヒドイデ)(0748),"Toxapex is a small Pokémon, encased by a dome made of its large blue legs. These legs are coated in spikes so toxic it is known to incapacitate a Wailord for days. Like Mareanie, it is based on theAcanthaster."
MudbrayDorobanko(ドロバンコ)(0749),"The mud stuck to Mudbray's hooves enhances its grip and powerful running gait. It can pull loads up to 50 times its own weight, however, its stubborn disposition makes it more difficult to work with than its evolution."
MudsdaleBanbadoro(バンバドロ)(0750),"Mudsdale makes its own mud and uses it to increase its strength and grip. Now able to carry loads up to 10 tons, it is incredibly popular on farms. Despite this, it was nearly hunted to extinction in the past. It is a Ride Pokémon inSun,Moonand its counterparts."
DewpiderShizukumo(シズクモ)(0751),"A small green spider, Dewpider cannot breathe air, and requires water to breathe. When it comes onto land, it takes water with it in the form of a bubble on its head. It and its evolution are based on thediving bell spider."
AraquanidOnishizukumo(オニシズクモ)(0752),"It hunts smaller Pokémon, trapping them in its bubbles where they drown. Araquanid often dote on Dewpider, putting them inside its bubble and letting them eat any leftover food. It is the totem Pokémon of Lana's Trial inUltra SunandUltra Moon. It is noticeably larger than its pre evolution."
FomantisKarikiri(カリキリ)(0753),"During the day, Fomantis basks in sunlight and sleeps peacefully. It wakes and moves around at night. When bathed in sunlight, this Pokémon emits a sweet scent, which often attracts Cutiefly."
LurantisRarantesu(ラランテス)(0754),"For self-protection, it pretends to be a bug Pokémon. However, instead of an insect that resembles a flower, it is a flower that resembles an insect. It fires beams from its sickle-shaped petals. These beams are powerful enough to cleave through thick metal plates. Lurantis is based on theOrchid Mantis. Lurantis is the totem Pokémon of Mallow's Trial."
MorelullNemashu(ネマシュ/)(0755),It lulls unsuspecting people and Pokémon to sleep and drains their energy. Morelull's mushroom cap is incredibly tasty and is sought after by many Pokémon.
ShiinoticMashēdo(マシェード)(0756),"It emits flickering spores that cause drowsiness. When its prey succumb to sleep, this Pokémon feeds on them by sucking in their energy. It fights for territory with Parasect."
SalanditYatōmori(ヤトウモリ)(0757),"Salandit can only evolve into Salazzle if it is a female.[35]It burns its bodily fluids to create a poisonous gas. When its prey become disoriented from inhaling the gas, it attacks them."
SalazzleEnnyūto(エンニュート)(0758),"Salazzle is a female-only species, due to the fact that only female Salandit can evolve.[35]Its body emitspheromonesthat cause males of any species, including Salandit, to obey it. Salazzle is based on theMourning Geko, an all female species of lizard. Totem Pokémon of Kiawe's Trial inSunandMoon."
Stufful(ヌイコグマ Nuikoguma)(0759),"Even though it looks adorable and weak, even a kick will send a pro wrestler sprawling. Despite this, it is not a strong fighter, relying on flailing its powerful arms wildly. It resembles a stuffed plush of aRed Panda."
BewearKiteruguma(キテルグマ)(0760),"An immensely dangerous Pokémon. If one encounters a Bewear in the wild and it attempts to give you a hug, you had better run as this is a warning. Oftentimes it kills its prey with its spine-snapping squeezes. In theanime, Team Rocket lives with a friendly Bewear in its den whilst operating in Alola. Bewear will often rush and pick them up in a time of crisis."
BounsweetAmakaji(アマカジ)(0761),"A wafting aroma comes from it that attracts bird Pokémon. It is often swallowed whole by Toucannon. By spinning its petals, it can fly for short distances."
SteeneeAmamaiko(アママイコ)(0762),"Thesepalson its head developed to protect its body. These are quite hard, so bird Pokémon do not bother it. Anyone who inhales its scent will feel a surge of happiness."
TsareenaAmājo(アマージョ)(0763),"Its legs are not just for show, they are used to show off too. It is a vicious tempered Pokémon, but if you touch the crown on its head, it will calm down. One kick from this cruel hearted Pokémon's hard tipped legs will leave the victim with a wound and soul that will never heal. Some beauty salons use it as a mascot for advertisements. Quaquaval is its rival."
ComfeyKyuwawā(キュワワー)(0764),"It stretches sticky vines out from its head and picks flowers to adorn itself with. When it does not have any flowers, it feels uneasy. The flowers are not a part of its body. Comfey is native toHawaiiinPokémon Go."
OranguruYareyūtan(ヤレユータン)(0765),"Known for its extreme intelligence, Oranguru is smart enough to operate Pokéballs. It is difficult to train and will often look down on inexperienced trainers."
PassimianNagetsukesaru(ナゲツケサル)(0766),"They use hardened berries as weapons. Passimian live in groups of up to 20 individuals, and mark their troupe with leaves placed on their bodies."
WimpodKosokumushi(コソクムシ)(0767),"This Pokémon is a coward. As it desperately dashes off, the flailing of its many legs leaves a sparkling clean path in its wake."
GolisopodGusokumusha(グソクムシャ)(0768),They live in sunken ships or in holes in the seabed. It mediates deep in the ocean where light cannot reach.
SandygastSunabaa(スナバァ)(0769),"They live on popular beaches. Sandygast takes control of anyone who puts their hand into its mouth, forcing them to make its body bigger."
PalossandShirodesuna(シロデスナ)(0770),"It resembles asandcastle. Palossand hypnotize people to build it up with sand only to swallow and suffocate them. If one dies, you can find buried bones under it from the lives it took to feed from."
PyukumukuNamakobushi(ナマコブシ)(0771),"It lives in shallow seas, such as areas near a beach. It can eject its internal organs, which it uses to engulf its prey or battle enemies. Sometimes they wash on shore, and they can dry out. People hold competitions as to who can chuck more of them into the water."
Type: NullTaipu: Nuru(タイプ：ヌル)(0772),"AchimeraLegendary Pokémon, Type: Null was created by Branch Chief Faba of the Aether Foundation as a means of combatting Ultra Beasts; canonically, only three of these creatures were made, and called Type: Full. They contain cells from all 18 types of Pokémon and were designed to be able to shift between any of the types through the RKS System. However, they went berserk when this system was activated and were fitted with restraining devices before being placed in cryogenic stasis indefinitely, at which time they were renamed Type: Null. Its heavy control mask limits its capabilities. It has some sort of special power. This experiment was recreated in Galar too."
SilvallyShiruvadi(シルヴァディ)(0773),"Raised under the care of Gladion, one of the escaped Type: Null broke its restraining device and was able to control its RKS System. This evolution was named Silvally by Gladion. Having full control of the RKS System, Silvally is able to change between any of the 18 types through the use of memory disks, in a similar fashion to the Mythical PokémonArceus."
MiniorMeteno(メテノ)(0774),"These Pokémon live in theOzone Layer, and are food for other stronger Pokémon. They only fall to Earth when their shells become too heavy. Its Ability, Shields Down, allows it to change forms depending on its HP. It comes in the seven colors of the rainbow."
KomalaNekkoara(ネッコアラ)(0775),"Komala arekoala-like Pokémon that are known for sleeping.[33]It is born asleep and will die asleep. Apparently, this is because of the sedative leaves it eats. It can eat, fight, and play while asleep."
TurtonatorBakugamesu(バクガメス)(0776),Turtonator is aMata mataturtle-like Pokémon with a landmine-like shell. Its shell is chemically unstable and explodes violently if touched. The hole in its stomach is its weak point. Its poop is also explosive.
TogedemaruTogedemaru(トゲデマル)(0777),"Togedemaru are white-bodied rodent Pokémon which seem to be inspired by thehedgehog.[36]It cannot produce electricity very well, so it directs lightning to itself like a lightning rod in storms. It is the totem Pokémon of Sophocles's Trial inUltra SunandUltra Moon."
MimikyuMimikkyu(ミミッキュ)(0778),"Mimikyu hides itself in an old rag it created to resemble Pikachu in an attempt to get closer to others. If its disguise is ruined, it will cry in pain as it tries to fix it and seek revenge on whoever did it. A scholar and a scientist once died after looking at what's underneath its costume.  It is the totem Pokémon of Acerola's Trial."
BruxishHagigishiri(ハギギシリ)(0779),"Bruxish is based on thereef triggerfish.[34]It will gnash its teeth at anything, making a sound like grinding metal. Its skin is thick enough to fend off Mareanie's spikes, which it preys on. Not even Shellder's shell is safe from its teeth."
DrampaJijīron(ジジーロン)(0780),"Drampa lives in mountains far from civilization. It is very kind to children, but if they are bullied, Drampa will go and burn the bullies' house down."
DhelmiseDadarin(ダダリン)(0781),"After a piece of seaweed merged with debris from a sunken ship, it was reborn as this ghost Pokémon. One swing of its anchor and it can knock out a Wailord. It gets along well with Dragalge."
Jangmo-oJarako(ジャラコ)(0782),Jangmo-o strikes its scales to communicate with others of its kind. Its scales are actually fur that have become as hard as metal. They can be melted into pots.
Hakamo-oJarango(ジャランゴ)(0783),It sheds and regrows its scales on a continuous basis. The scales become harder and sharper each time.
Kommo-oJararanga(ジャラランガ)(0784),It clatters its tail scales to unnerve opponents. This Pokémon will battle only those who stand steadfast in the face of this display. It is the totem Pokémon of the Vast Poni Canyon Trial.
Tapu KokoKapu Kokeko(カプ・コケコ)(0785),"The guardian of Melemele Island.[37]Based on the Hawaiian godKū, it summons thunderclouds and stores the lightning inside its body. Despite its benevolent nature, it can be quick to anger. However, a split second later, it tends to forget what angered it."
Tapu LeleKapu Tetefu(カプ・テテフ)(0786),"The guardian of Akala Island.[37]Based on the Hawaiian godKāne. Even though Tapu Lele is devoid of guilt about its cruel disposition and can be described as nature incarnate, it heals the wounds of people and Pokémon by sprinkling them with its sparkling scales. While it thinks it is playing around, it can actually be quite cruel to whoever it is with."
Tapu BuluKapu Bururu(カプ・ブルル)(0787),"The guardian of Ula'ula Island.[37]Based on the Hawaiian godLono. It is known as the land deity, and can grow and control vegetation. It makes ringing sounds with its tail to let others know where it is, avoiding unneeded conflicts. Tapu Bulu is the kindest of the guardians."
Tapu FiniKapu Rehire(カプ・レヒレ)(0788),"The guardian of Poni Island.[37]Based on the Hawaiian godKanaloa. Using the energy of the ocean waves, it can create dense fog. Tapu Fini is said to be the bridge between the real world and theafterlife. It is said that if Tapu Fini creates its fog, one may see their deceased loved ones in the fog."
CosmogKosumoggu(コスモッグ)(0789),"A Cosmog named Nebby plays a central role in the story ofPokémon Sun,Moon,Ultra SunandUltra Moon,having been stolen from the Aether Foundation by Lillie. It travels with her for the majority of the game before evolving. It collects dust from the atmosphere and grows. Despite the wind blowing its gaseous little body away, it really does not have a care in the world. When it is in a jam, it tends to teleport."
CosmoemKosumoumu(コスモウム)(0790),"Cosmoem evolves into Solgaleo inSunandUltra Sunand Lunala inMoonandUltra Moon. In ancient times it was called ""the cocoon of the stars"" so the king of Alola built a shrine to worship it. Its golden shell is very dense. Something seems to be growing inside as it keeps absorbing dust from the atmosphere."
SolgaleoSorugareo(ソルガレオ)(0791),"The mascot forSun, Solgaleo is a large, lion-like Pokémon that is revered as ""the beast that devours the sun"".[38]Solgaleo can be fused with Necrozma to become Dusk Mane Necrozma. It is based on the alchemicLion Devouring the Sun.The intense light it radiates from the surface of its body can rival the sun."
LunalaRunaāra(ルナアーラ)(0792),"The mascot forMoon, Lunala is a large, bat-like Pokémon that is revered as ""the beast that calls the moon"".[38]When its wings are spread wide, Lunala resembles a night sky and crescent moon.[38][39]Lunala can be fused with Necrozma to become Dawn Wings Necrozma. Lunala can devour light, drawing a moonless dark veil of night over the brightness of day."
NihilegoUtsuroido(ウツロイド)(0793),"Known as UB-01 Symbiont,[40]as seen in the climax ofSunandMoon, it is an Ultra Beast that appeared from an Ultra Wormhole. It is a parasite that lives by feeding on people and Pokémon, and people have reported those infested by it suddenly becoming very violent due to its strong neurotoxin.  If the Ultra Beast takes control of a Trainer, and if that Trainer has a team of Pokémon, the Pokémon will be placed under Nihilego's control. When battled, it is impossible to defeat them, as the Ultra Beast's power will revive them. It is unclear whether or not Nihilego is actually sentient, but people have seen it act like a young girl. It might be a dangerous alien here, but it is apparently a common organism in its home world, the Ultra Deep Sea. Nihilego appear to be made of a glass-like substance."
BuzzwoleMasshibūn(マッシブーン)(0794),"Known as UB-02 Absorption,[40]It is an Ultra Beast that appeared from an Ultra Wormhole. It feeds by sucking the life out of people and Pokémon, which makes its already swollen muscles stronger. It goes around flexing its muscles, but it is unclear whether this is a greeting or a warning. People have seen it pulverize a dump truck with a single punch. It might be a dangerous alien here, but it is apparently a common organism in its home world, the Ultra Jungle."
PheromosaFerōche(フェローチェ)(0795),"Known as UB-02 Beauty,[40]its an Ultra Beast that appeared from an Ultra Wormhole. Pheromosa are feminine Pokémon that can move at extremely quick speeds and give off a pheromone that causes any creature nearby to become infatuated with them. A species ofcockroachhas even been named after it. Its body is thin and supple, but it possesses great speed and power.  It refuses to touch anything, most likely due to it sensing uncleanliness in this world. It might be a dangerous alien here, but it is apparently a common organism in its home world, the Ultra Desert."
XurkitreeDenjumoku(デンジュモク)(0796),"Known as UB-03 Lighting,[40]it is an Ultra Beast that appeared from an Ultra Wormhole. It resembles wires and large trees. Electric shocks emanate from its entire body and it once raided a power plant, so we believe it energizes itself with electricity. Some Xurkitree stand unmoving, with their arms and legs stuck in the ground to drain electricity. It might be a dangerous alien here, but it is apparently a common organism in its home world, the Ultra Plant."
CelesteelaTekkaguya(テッカグヤ)(0797),"Known as UB-04 Blaster,[40]it is an Ultra Beast that appeared from an Ultra Wormhole. Celesteela are rocket-like life forms that expel a powerful gas stored within themselves for flight. Readings of high energy can be detected from both of its huge arms. Witnesses say they have seen it burn down a forest by expelling gas from both its arms and flying through the sky at high speed. It might be a dangerous alien here, but it is apparently a common organism in its home world, the Ultra Crater. They create theRP-1-like rocket fuel by absorbing the nutrients of nearby plants. Despite their Steel typing, they are plant-like in composition. Celesteela is based onThe Tale of The Bamboo Cutterand the stories'Princess Kaguya."
KartanaKamitsurugi(カミツルギ)(0798),"Known as UB-04 Blade,[40]it is an Ultra Beast that appeared from an Ultra Wormhole. Kartana are origami-like Pokémon with impossibly sharp edges all over their bodies that can cut anything. Its light, paper-like body allows it to evade most attacks by simply floating out of the way, but it also makes it highly vulnerable to fire and moisture. It does not seem to attack opponents on its own, but its body is as sharp as a sword, never getting dull. It was once observed to cut down a gigantic steel tower with a single stroke of its blade. Although it is alien to this world and a danger here, it is apparently a common organism in its home world, the Ultra Forest. As demonstrated in the anime, the edges are sharp enough to open up an Ultra Wormhole."
GuzzlordAkujikingu(アクジキング)(0799),"Known as UB-05 Glutton,[40]it is an Ultra Beast that appeared from an Ultra Wormhole. Guzzlord is said to feel like hard rubber, and in order to eat, its tongue moves in a wave-like motion that pulls food towards its mouth. Its constant hunger causes it to eat anything within reach of its two, pincer-like tongues. Despite its constant hunger and appetite, no droppings have ever been found. It is speculated to convert everything it consumes into energy with no waste leftover. According to reports about it, it has gobbled mountains and swallowed buildings whole. Although it is alien to this world and a danger here, it is apparently a common organism in its home world, the Ultra Ruin."
NecrozmaNekurozuma(ネクロズマ)(0800),"An ancient creature associated with Ultra Beasts that uses prisms and light refraction to attack. It is also codenamed UB: Black in the anime. It has a major role in the story ofUltra SunandUltra Moon, possessing Solgaleo or Lunala depending on the version, becoming Dusk Mane Necrozma or Dawn Wings Necrozma respectively, and will absorb the endless light that they emit. It lives in the Ultra Megalopolis."
Unknown,"""Dusk Mane Necrozma"", the mascot of (and exclusive to)Ultra Sun. Its vicious temper and crystallinne claws make it a danger to be around. Solgaleo has no say in this form because its body has been taken over by Necrozma. Using its armor that it gave Solgaleo, it can propel itself forward by shooting black light."
Unknown,"""Dawn Wings Necrozma"", the mascot of (and exclusive to)Ultra Moon. Lunala is completely helpless since Necrozma took full control of its body. Its temper is so vicious it will expel all of its energy tearing up its victims. It can fire dark energy out of its body."
